_id,press,title,content
65e810208b0bc9bad7e1c42a,매일경제,`미래의 잡스` 위한 보금자리 만든다,"단순히 주방과 화장실 등 공용 시설을 함께 사용하며 살아가는 셰어하우스와는 달리, 코리빙은 공용 공간을 함께 사용하는 복합 주거 공간을 넘어 네트워킹과 커뮤니티가 더해진 개념의 주거 형태다. 코리빙은 창업자들에게 가장 적합한 주거 형태로 꼽힌다. 다양한 분야의 사람들과 교류하며 발견하지 못했던..."
65e810228b0bc9bad7e1c42b,비욘드포스트,"리베토코리아, 서울시 창업자 주거사업 입주 개시","단순히 주방과 화장실 등 공용 시설을 함께 사용하며 살아가는 셰어하우스와는 달리, 코리빙은 공용 공간을 함께 사용하는 복합 주거 공간을 넘어 네트워킹과 커뮤니티가 더해진 개념의 주거 형태다. 코리빙은 창업자들에게 가장 적합한 주거 형태로 꼽힌다. 다양한 분야의 사람들과 교류하며 발견하지..."
65e810248b0bc9bad7e1c42c,매경이코노미언론사 선정,‘탈가족 시대’ 이상한 정상가족…혈연·결혼 NO ‘분자가족’ 봇물,"▶달라지는 경제 트렌드 ▷코리빙하우스, 세대분리 아파트 인기 전통적인 가족 관념이 깨지면서 기업 마케팅 전략도 달라지고 있다. 부동산 시장에서는 1인 가구 타깃으로 ‘코리빙하우스’라는 신개념 주택이 등장했다. 침실 등 개인 공간은 철저히 분리하되 생활, 문화 공간은 입주민들과 공유하는 주거..."
65e810268b0bc9bad7e1c42d,대구신문,[문화칼럼] 어디로 가오리까,코리빙하우스는 어떻게 보면 살기 좋은 도시의 전형적 모습이 거주공간의 형태로 나타난 것이라고 할 수 있다. 우리가 일반적으로 자신이 소유하고 있는 집의 사이즈를 키우는 데는 여러 가지 현실적 한계가 따른다. 따라서 사람이 인간답게 행복한 삶을 누리기 위한 생활공간의 필요충분조건을 자기 집안에...
65e810288b0bc9bad7e1c42e,독서신문,"해커톤 토론→끝장 토론, 미닝 아웃→소신 소비… '키 비주얼'은?","세 번째는 '코리빙 하우스'(co-living house)이다. 개인 공간은 분리하되, 건물 내 공용 공간을 입주민들이 공유하는 새로운 공동 주거 형태를 말한다. '쉐어하우스'(sharehouse)로 불리기도 하는데, 개인이 운영하던 게스트하우스에서 유래했으며 '기업형'으로 운영된다는 특징이 있다. 는 최근..."
65e8102a8b0bc9bad7e1c42f,독서신문,"해커톤 토론→끝장 토론, 미닝 아웃→소신 소비… '키 비주얼'은?","세 번째는 '코리빙 하우스'(co-living house)이다. 개인 공간은 분리하되, 건물 내 공용 공간을 입주민들이 공유하는 새로운 공동 주거 형태를 말한다. '쉐어하우스'(sharehouse)로 불리기도 하는데, 개인이 운영하던 게스트하우스에서 유래했으며 '기업형'으로 운영된다는 특징이 있다. 는 최근..."
65e8102d8b0bc9bad7e1c430,아트인사이트,[오피니언] 지금 어떻게 살고 있나요? [문화 공간],바로 코리빙 하우스(Co-living house)이다. © Samantha Gades 밀레니얼 세대의 특징인 '얕고 느슨한 연대'를 가장 잘 드러내는 주거 형태이기도 한 코리빙 하우스는 과도하게 많은 것을 공유하는 셰어하우스의 불편함을 보완하기 위한 새로운 공유 주거 문화이다. 사람들과 함께 어울리면서도 자신만의 영역을 지키고...
65e8102f8b0bc9bad7e1c431,오마이뉴스,[오마이포토] '연애는 귀찮지만' 2030 연애이야기,"<연애는 귀찮지만 외로운 건 싫어!>는 연애는 하고 싶은데 심각한 건 부담스럽고, 자유는 누리고 싶은데 외로운 건 싫은 젊은이들이 코리빙 하우스(co-living house)에 모여 사는 이야기를 그린 로맨스 드라마다. 11일 화요일 밤 10시 50부 첫 방송. ▲ '연애는 귀찮지만' 2030 연애이야기 공찬, 지현우, 김소은..."
65e810318b0bc9bad7e1c432,머니투데이언론사 선정,"[르포]살며, 일하며, 어울리며…재도약 꿈꾸는 제주 스위스마을","제주 중산간 약 2만㎡ 면적의 '스위스마을'은 관광특화 타운형 코리빙하우스로 자리잡았다. 감귤밭만 늘어섰던 와산리에 변화가 생긴건 지난 2016년. 스위스마을 1·2단지가 차례로 들어섰고 이후 3·4단지까지 입주하며 현재 모습이 완성됐다. 분양받은 입주민 대부분은 1층은 상가로, 2층은 민박 등 숙박시설로..."
65e810338b0bc9bad7e1c433,아시아경제,'미닝 아웃' 대신 '소신 소비'라고 말해요,아울러 ‘페이스 실드(face shield)’와 ‘코리빙 하우스(co-living house)’를 대체할 우리말로 각각 ‘얼굴 가림막’과 ‘공간 나눔 주택’을 추천했다. ‘미닝 아웃’은 특정 상품을 사고 공유함으로써 자기 취향이나 신념 따위를 표출하는 일을 말한다. 대체어인 ‘소신 소비’ 선정에는 설문조사 결과가...
65e810358b0bc9bad7e1c434,대한경제,"부산 동아대 건축학과 학생들, 부산시 주최 ‘청년도시재생사 청년캠프톤’ 금...",부산 영도 봉래동 모빌리티·코리빙하우스 등 제안 ‘O-BASE(ZERO-BASECAMP)’ 마스터플랜으로 부산 동아대학교 건축학과(학과장 이상진)는 재학생들이 부산시 주최 ‘청년도시재생사 청년캠프톤’에서 금상을 받았다고 14일 밝혔다. 부산광역시도시재생지원센터 주관으로 열린 ‘청년도시재생사 청년캠프톤’...
65e810378b0bc9bad7e1c435,디자인정글,"오래된 여관, 청년들의 주거공간이 되다","코리빙하우스 프롭테크 스타트업 게릴라즈의 '게릴라 하우스' 프로토타입을 선보인다.ⓒ Design Jungle게릴라즈는 오래된 여관 건물을 청년들의 대안적인 주거 공간으로 재생시키는 코리빙하우스 프롭테크(Co-living House Prop Tech) 스타트업으로, 이번 전시를 통해 그들이 청년 주택문제에 대한 해결방안으로..."
65e810398b0bc9bad7e1c436,조선일보,세계는 구독경제... 곧 글로벌 기업 75%가 구독 서비스,코리빙 하우스는 한 채의 집을 나눠서 쓰는 셰어 하우스와 달리 개인 공간은 분리하되 건물 내 공용 공간을 두고 다양한 프로그램을 운영하는 새로운 개념의 주거공간이다. 셰어 하우스에 공간구독의 개념을 더한 것으로 보면 된다. 배씨는 계약 기간이 끝나면 강남에만 수십 곳에 달하는 다른 를...
65e8103b8b0bc9bad7e1c437,이코노미조선,[구독경제 3.0 시대] 2023년 전 세계 기업 75%가 구독 서비스 제공,코리빙 하우스는 한 채의 집을 나눠서 쓰는 셰어 하우스와 달리 개인 공간은 분리하되 건물 내 공용 공간을 두고 다양한 프로그램을 운영하는 새로운 개념의 주거공간이다. 셰어 하우스에 공간구독의 개념을 더한 것으로 보면 된다. 배씨는 계약 기간이 끝나면 강남에만 수십 곳에 달하는 다른 를...
65e8103d8b0bc9bad7e1c438,매일경제,당신만 모르고 있는 2020년 새로운 주거 소비 트렌드,"코리빙하우스는 개인의 방을 작게 임대하고 거실 같은 넓은 공간은 공유하는 개념입니다. 신세대를 강타하는 새로운 주거 트렌드 요즘 잘나가는 신세대들은 당신과 다른 곳에 산다 이 흐름을 이어받아 마침내 프리미엄 코리빙 서비스까지 나타났는데요, 2019년 5월 패스트파이브(FASTFIVE)가 론칭한..."
65e8103f8b0bc9bad7e1c439,조선일보,세계는 구독경제... 곧 글로벌 기업 75%가 구독 서비스,코리빙 하우스는 한 채의 집을 나눠서 쓰는 셰어 하우스와 달리 개인 공간은 분리하되 건물 내 공용 공간을 두고 다양한 프로그램을 운영하는 새로운 개념의 주거공간이다. 셰어 하우스에 공간구독의 개념을 더한 것으로 보면 된다. 배씨는 계약 기간이 끝나면 강남에만 수십 곳에 달하는 다른 를...
65e810418b0bc9bad7e1c43a,이코노미조선,[구독경제 3.0 시대] 2023년 전 세계 기업 75%가 구독 서비스 제공,코리빙 하우스는 한 채의 집을 나눠서 쓰는 셰어 하우스와 달리 개인 공간은 분리하되 건물 내 공용 공간을 두고 다양한 프로그램을 운영하는 새로운 개념의 주거공간이다. 셰어 하우스에 공간구독의 개념을 더한 것으로 보면 된다. 배씨는 계약 기간이 끝나면 강남에만 수십 곳에 달하는 다른 를...
65e810438b0bc9bad7e1c43b,매일경제,당신만 모르고 있는 2020년 새로운 주거 소비 트렌드,"코리빙하우스는 개인의 방을 작게 임대하고 거실 같은 넓은 공간은 공유하는 개념입니다. 신세대를 강타하는 새로운 주거 트렌드 요즘 잘나가는 신세대들은 당신과 다른 곳에 산다 이 흐름을 이어받아 마침내 프리미엄 코리빙 서비스까지 나타났는데요, 2019년 5월 패스트파이브(FASTFIVE)가 론칭한..."
65e810458b0bc9bad7e1c43c,스마트투데이,"프롭테크 홈즈컴퍼니, 케이팝 스타트업 모드하우스와 맞손","홈즈컴퍼니(대표 이태현)는 케이팝(K-POP) 스타트업 모드하우스(대표 정병기)와 '글로벌 케이컬처(K-Culture) 코리빙 사업'을 위한 업무협약(MOU)을 체결했다고 21일 밝혔다. 홈즈컴퍼니가 운영하는 코리빙 공간과 라운지 등 다양한 형태의 주거 공간을 모드에 지원하고, 모드는 소속..."
65e810478b0bc9bad7e1c43d,파이낸셜포스트,"[블록체인 뉴스 브리핑] 비트맥스,이더제로,마이크레딧체인,KTN,그래피,알고랜...","국내 대표 P2P금융기업 어니스트펀드(대표 서상훈)는 글로벌 코리빙 하우스 '에이블하우스'를 운영하는 코티에이블(대표 안혜린)과 17일 서울 여의도 어니스트펀드 본사에서 양해각서(MOU)를 체결하고, 청년 공유주택 공급을 위한 전략적 제휴를 맺는다고 18일 밝혔다. 코리빙(Co-living)이란 여러 명의..."
65e810498b0bc9bad7e1c43e,이투데이,"어니스트펀드-코티에이블, 청년 공유주택 공급 MOU…""청년주거 문제 해소 맞손...","국내 대표 P2P금융기업 어니스트펀드는 글로벌 코리빙 하우스 ‘에이블하우스’를 운영하는 코티에이블과 17일 서울 여의도 어니스트펀드 본사에서 양해각서(MOU)를 체결하고, 청년 공유주택 공급을 위한 전략적 제휴를 맺었다고 18일 밝혔다. 코리빙(Co-living)이란 여러 명의 사람들이 하나의 주택을 공유하며..."
65e8104b8b0bc9bad7e1c43f,EBN,"디캠프-이지스자산운용, 2월 디데이 성황리 개최",이번 행사에서 글로벌 코리빙 하우스를 운영하는 코티에이블과 인테리어 공사에 대기업 지정 시공사를 고객에게 중개해주는 인테리어젠틀맨이 공동 우승을 차지해 각각 1000만원의 상금을 받았다. 디데이를 공동 개최한 이지스자산운용은 우승 상금 1000만원과 공유 오피스 입주권을 제공한다....
65e8104d8b0bc9bad7e1c440,데일리팝,'1인가구 삶의 질 높여라' 이색 구독서비스 톺아보기,"원룸텔, 고시텔, 고시원 등의 코리빙하우스에 대한 구독 서비스를 제공하는 것이다. 앱 안에서 검색부터 3D룸투어, 계약, 결제까지 한 번에 해결할 수 있다는 점이 가장 큰 특징이다. 대개 월세는 현금 납부가 원칙이지만, 독립생활로 구독하는 경우 카드결제는 물론 네이버페이, 카카오페이 등의 간편결제도..."
65e8104f8b0bc9bad7e1c441,시사오늘,"GS25, 편GPT 예능 콘텐츠 론칭…공영홈쇼핑, '맘껏 사는 4월' 이벤트 [유통오...","트러스테이, 코리빙하우스 'heyy, 신정' 오픈 야놀자클라우드와 KT에스테이트 합작사 트러스테이는 양천구 신정동에 코리빙하우스 'heyy, 신정'을 개소했다고 10일 밝혔다. '미아·군자'에 이어 신정동에 새롭게 문을 연 heyy, 신정은 프롭테크 솔루션 기반의 스마트 주거 경험과 '삶'과 '쉼'의 조화로운 균형을..."
65e810518b0bc9bad7e1c442,디지털타임스,서글픈 민달팽이의 꿈 `공유 주택`으로 이룬다,6일 업계에 따르면 국내 P2P금융기업 어니스트펀드와 글로벌 코리빙 하우스 '에이블하우스'를 운영하는 코티에이블이 최근 청년 공유주택 공급을 위한 전략적 제휴를 맺었다. 코리빙(Co-living)이란 여러 명의 사람들이 하나의 주택을 공유하며 주거하는 모델을 말한다. 다른 사람들과 취미와 생활을 함께할 수 있는...
65e810538b0bc9bad7e1c443,이데일리,"어니스트펀드, 청년 공유주택 코티에이블과 업무제휴","P2P 금융업체인 어니스트펀드는 글로벌 코리빙 하우스 ‘에이블하우스’를 운영하는 코티에이블과 양해각서(MOU)를 체결하고, 청년 공유주택 공급을 위한 전략적 제휴를 맺는다고 18일 밝혔다. 코리빙(Co-living)이란 여러 명의 사람들이 하나의 주택을 공유하며 주거하는 방식이다. 취미와 생활을 함께하는..."
65e810558b0bc9bad7e1c444,EBN,"디캠프-이지스자산운용, 2월 디데이 성황리 개최",이번 행사에서 글로벌 코리빙 하우스를 운영하는 코티에이블과 인테리어 공사에 대기업 지정 시공사를 고객에게 중개해주는 인테리어젠틀맨이 공동 우승을 차지해 각각 1000만원의 상금을 받았다. 디데이를 공동 개최한 이지스자산운용은 우승 상금 1000만원과 공유 오피스 입주권을 제공한다....
65e810578b0bc9bad7e1c445,데일리팝,'1인가구 삶의 질 높여라' 이색 구독서비스 톺아보기,"원룸텔, 고시텔, 고시원 등의 코리빙하우스에 대한 구독 서비스를 제공하는 것이다. 앱 안에서 검색부터 3D룸투어, 계약, 결제까지 한 번에 해결할 수 있다는 점이 가장 큰 특징이다. 대개 월세는 현금 납부가 원칙이지만, 독립생활로 구독하는 경우 카드결제는 물론 네이버페이, 카카오페이 등의 간편결제도..."
65e810598b0bc9bad7e1c446,시사오늘,"GS25, 편GPT 예능 콘텐츠 론칭…공영홈쇼핑, '맘껏 사는 4월' 이벤트 [유통오...","트러스테이, 코리빙하우스 'heyy, 신정' 오픈 야놀자클라우드와 KT에스테이트 합작사 트러스테이는 양천구 신정동에 코리빙하우스 'heyy, 신정'을 개소했다고 10일 밝혔다. '미아·군자'에 이어 신정동에 새롭게 문을 연 heyy, 신정은 프롭테크 솔루션 기반의 스마트 주거 경험과 '삶'과 '쉼'의 조화로운 균형을..."
65e8105c8b0bc9bad7e1c447,디지털타임스,서글픈 민달팽이의 꿈 `공유 주택`으로 이룬다,6일 업계에 따르면 국내 P2P금융기업 어니스트펀드와 글로벌 코리빙 하우스 '에이블하우스'를 운영하는 코티에이블이 최근 청년 공유주택 공급을 위한 전략적 제휴를 맺었다. 코리빙(Co-living)이란 여러 명의 사람들이 하나의 주택을 공유하며 주거하는 모델을 말한다. 다른 사람들과 취미와 생활을 함께할 수 있는...
65e8105e8b0bc9bad7e1c448,플래텀,"[Startup’s Story #449] 중국서 공유주택 열기 일으킨 창업가, 한국서 이어간...","유플러스는 코리빙 하우스이기도 하지만,기숙형 창업시설이기도 하다.코리빙, 코워킹, 코네트워킹을 제공하는 한편 주거, 사무, 레저, 엔터테인먼트적 요소도 혼합되어 있다.1, 2선 도시에 창취업을 위해 이주한 청년층이 주요 고객이다. 유플러스는 중국서 창업 인프라가 조성된 주요 도시 9곳에서 22여 개..."
65e810608b0bc9bad7e1c449,매일경제,"엠지알브이, 임대형 기숙사 규정 신설, 공유주거 기준 등 법제화 이끌어내","한편, 엠지알브이는 코리빙 하우스 맹그로브 숭인 신설 동대문 신촌 지점을 운영 중이다. 청년 가구의 주거 문제 해결을 시작으로, 중장년층 등 전 세대를 위한 진보적인 주거 솔루션을 제공하고자 공간 기획부터 운영에 이르기까지 역량 강화에 박차를 가하고 있다."
65e810628b0bc9bad7e1c44a,머니투데이,"MZ세대가 찾는 1인 주거 플랫폼 '고방', 월이용자 20만명 돌파","고방은 원룸텔, 고시원, 쉐어하우스, 코리빙, 청년주택, 룸메이트 등 1인 가구를 대상으로 한 다양한 주거정보를 한곳에 모아주는 플랫폼이다. 주거 매물뿐만 아니라 자취꿀팁, 청년지원 정책 등 1인 가구에 필요한 정보 콘텐츠를 제공한다. 원룸텔, 고시원, 쉐어, 등 대안주거를 다루는..."
65e810648b0bc9bad7e1c44b,테크노아,"빔모빌리티, 커먼타운과 파트너십 체결","빔모빌리티가 코오롱하우스비전의 코리빙 브랜드 커먼타운과 파트너십을 체결하고, 입주민들에게 새로운 도심 이동 편의성을 제공한다고 밝혔다. 커먼타운은 코오롱하우스비전이 공유주거 라이프스타일을 개발/선도하기 위해 2016년에 런칭한 브랜드로 대표적인 상품인 역삼 트리와 신도림081 지점은..."
65e810668b0bc9bad7e1c44c,벤처스퀘어,"빔모빌리티, 커먼타운과 파트너십 체결","퍼스널모빌리티 공유서비스 기업 빔모빌리티가 코오롱하우스비전의 코리빙(co-living)브랜드 커먼타운과 파트너십을 체결하고, 입주민들에게 새로운 도심 이동 편의성을 제공한다고 밝혔다. 커먼타운은 코오롱하우스비전이 공유주거 라이프스타일을 개발·선도하기 위해 2016년에 런칭한 브랜드로 대표적인..."
65e810688b0bc9bad7e1c44d,IT조선,"어니스트펀드, 코티에이블과 청년 공유주택 공급 위한 MOU 체결",국내 P2P금융 기업 어니스트펀드는 글로벌 코리빙 하우스 ‘에이블하우스’를 운영하는 코티에이블과 청년 공유주택 공급을 위해 제휴하고 양해각서(MOU)를 체결했다고 18일 밝혔다. 코리빙(Co-living)은 여러 명의 사람들이 하나의 주택을 공유하며 주거하는 공간이다. 취미와 생활을 함께하는 커뮤니티공간부터...
65e8106a8b0bc9bad7e1c44e,플래텀,"[Startup’s Story #449] 중국서 공유주택 열기 일으킨 창업가, 한국서 이어간...","유플러스는 코리빙 하우스이기도 하지만,기숙형 창업시설이기도 하다.코리빙, 코워킹, 코네트워킹을 제공하는 한편 주거, 사무, 레저, 엔터테인먼트적 요소도 혼합되어 있다.1, 2선 도시에 창취업을 위해 이주한 청년층이 주요 고객이다. 유플러스는 중국서 창업 인프라가 조성된 주요 도시 9곳에서 22여 개..."
65e8106c8b0bc9bad7e1c44f,매일경제,"엠지알브이, 임대형 기숙사 규정 신설, 공유주거 기준 등 법제화 이끌어내","한편, 엠지알브이는 코리빙 하우스 맹그로브 숭인 신설 동대문 신촌 지점을 운영 중이다. 청년 가구의 주거 문제 해결을 시작으로, 중장년층 등 전 세대를 위한 진보적인 주거 솔루션을 제공하고자 공간 기획부터 운영에 이르기까지 역량 강화에 박차를 가하고 있다."
65e8106e8b0bc9bad7e1c450,머니투데이,"MZ세대가 찾는 1인 주거 플랫폼 '고방', 월이용자 20만명 돌파","고방은 원룸텔, 고시원, 쉐어하우스, 코리빙, 청년주택, 룸메이트 등 1인 가구를 대상으로 한 다양한 주거정보를 한곳에 모아주는 플랫폼이다. 주거 매물뿐만 아니라 자취꿀팁, 청년지원 정책 등 1인 가구에 필요한 정보 콘텐츠를 제공한다. 원룸텔, 고시원, 쉐어, 등 대안주거를 다루는..."
65e810708b0bc9bad7e1c451,테크노아,"빔모빌리티, 커먼타운과 파트너십 체결","빔모빌리티가 코오롱하우스비전의 코리빙 브랜드 커먼타운과 파트너십을 체결하고, 입주민들에게 새로운 도심 이동 편의성을 제공한다고 밝혔다. 커먼타운은 코오롱하우스비전이 공유주거 라이프스타일을 개발/선도하기 위해 2016년에 런칭한 브랜드로 대표적인 상품인 역삼 트리와 신도림081 지점은..."
65e810728b0bc9bad7e1c452,벤처스퀘어,"빔모빌리티, 커먼타운과 파트너십 체결","퍼스널모빌리티 공유서비스 기업 빔모빌리티가 코오롱하우스비전의 코리빙(co-living)브랜드 커먼타운과 파트너십을 체결하고, 입주민들에게 새로운 도심 이동 편의성을 제공한다고 밝혔다. 커먼타운은 코오롱하우스비전이 공유주거 라이프스타일을 개발·선도하기 위해 2016년에 런칭한 브랜드로 대표적인..."
65e810748b0bc9bad7e1c453,매일경제,홈즈컴퍼니·ICG 업무협약 프롭테크 기업에 3천억 투자,양사는 JV를 설립하고 최대 3000억원을 조성하기로 했다. 홈즈컴퍼니는 위탁운영사 역할을 맡아 국내에서 저평가된 호텔이나 건물을 매입하고 이를 코리빙 하우스나 호텔형 레지던스로 바꿔 운영한다. ICG는 영국 런던에 본사를 둔 글로벌 자산운용사다. 전체 운용자산 규모는 685억달러(약 85조원)다.
65e810768b0bc9bad7e1c454,데일리팝,[스타트업 소식] 테사·홈즈컴퍼니·아임웹 外,홈즈컴퍼니는 ICG의 한국 파트너로서 사실상 위탁운영사 역할을 맡아 국내에서 저평가된 호텔이나 건물을 매입하고 이를 최근 각광받는 코리빙 하우스나 호텔형 레지던스로 탈바꿈해 직접 운영하는 등 다양한 방식을 통해 수익성을 극대화한다는 계획이다. ICG와 함께 일본 등 해외에 소재한 부동산에...
65e810788b0bc9bad7e1c455,더벨,"[더벨][thebell interview]""큰장 선 민간기숙사형 임대, 공간 브랜딩 성패 좌...",미국이나 유럽처럼 100실이 넘는 대규모 코리빙 하우스 개발이 본격적으로 가능해진 셈이다. 제대로 된 기숙사 형태의 임대주택 안착을 위해선 개발 후 '운영' 노하우가 무엇보다 중요하다. 임대료는 아무래도 시장 저항선이 있다보니 다채로운 콘텐츠가 담겨 있어야 수익성을 높일 수 있다. 공간 콘텐츠 개발...
65e8107a8b0bc9bad7e1c456,조세일보,"[스타트업] 독립생활, 출시 8개월 만에 누적 매출 4억 돌파","독립생활 박영은 대표는 ""MZ세대의 주거공간 선택 니즈에 맞추어 코리빙하우스 운영자가 입실자를 응대하지 않더라도 독립생활 앱의 3D룸투어로 방 내부를 더욱 생생하게 보여줌으로서 임대인과 임차인의 편의성으로 높은 판매율을 기록하고 있다""며 ""앱에서 계약과 결제를 마치고 입실이 가능하기 때문에..."
65e8107c8b0bc9bad7e1c457,IT조선,"빔모빌리티, 코오롱 브랜드 '커먼타운' 내 전동킥보드 배치",퍼스널모빌리티 공유서비스 기업 빔모빌리티는 코오롱하우스비전의 코리빙(co-living) 브랜드 커먼타운과 파트너십을 체결하고 입주민들에게 새로운 도심 이동 편의성을 제공한다고 29일 밝혔다. 커먼타운은 코오롱하우스비전이 공유주거 라이프스타일을 개발·선도하기 위해 2016년 론칭한 브랜드다. 대표...
65e8107e8b0bc9bad7e1c458,데일리팝,[스타트업 소식] 테사·홈즈컴퍼니·아임웹 外,홈즈컴퍼니는 ICG의 한국 파트너로서 사실상 위탁운영사 역할을 맡아 국내에서 저평가된 호텔이나 건물을 매입하고 이를 최근 각광받는 코리빙 하우스나 호텔형 레지던스로 탈바꿈해 직접 운영하는 등 다양한 방식을 통해 수익성을 극대화한다는 계획이다. ICG와 함께 일본 등 해외에 소재한 부동산에...
65e810808b0bc9bad7e1c459,더벨,"[더벨][thebell interview]""큰장 선 민간기숙사형 임대, 공간 브랜딩 성패 좌...",미국이나 유럽처럼 100실이 넘는 대규모 코리빙 하우스 개발이 본격적으로 가능해진 셈이다. 제대로 된 기숙사 형태의 임대주택 안착을 위해선 개발 후 '운영' 노하우가 무엇보다 중요하다. 임대료는 아무래도 시장 저항선이 있다보니 다채로운 콘텐츠가 담겨 있어야 수익성을 높일 수 있다. 공간 콘텐츠 개발...
65e810828b0bc9bad7e1c45a,조세일보,"[스타트업] 독립생활, 출시 8개월 만에 누적 매출 4억 돌파","독립생활 박영은 대표는 ""MZ세대의 주거공간 선택 니즈에 맞추어 코리빙하우스 운영자가 입실자를 응대하지 않더라도 독립생활 앱의 3D룸투어로 방 내부를 더욱 생생하게 보여줌으로서 임대인과 임차인의 편의성으로 높은 판매율을 기록하고 있다""며 ""앱에서 계약과 결제를 마치고 입실이 가능하기 때문에..."
65e810848b0bc9bad7e1c45b,한국금융신문,"홈즈컴퍼니, 글로벌 자산운용사 ICG 손잡고 조인트벤처 설립",홈즈컴퍼니는 ICG의 한국 파트너로서 사실상 위탁운영사 역할을 맡아 국내에서 저평가된 호텔이나 건물을 매입하고 이를 최근 각광받는 코리빙 하우스나 호텔형 레지던스로 탈바꿈해 직접 운영하는 등 다양한 방식을 통해 수익성을 극대화한다는 계획이다. ICG와 함께 일본 등 해외에 소재한...
